qid	query	period	rank	docid	score	title	snippet	relevance
E02	OpenAI	pre	1	ymtd09	2.6836	OpenAI PHP	OpenAI PHP release with DALL•E 2 feature. Now you can easily generate images. [\#openai]( [\#php]( [\#composer]( [\#dalle2]( [\#dalle]( [	2
E02	OpenAI	pre	2	y0zrmx	2.6287	Internship in OpenAI	Does anyone know that if it's possible to do summer intern at OpenAI? I'm a PhD student in the US and I think the work from OpenAI is so amazing and I want to work with them in the next summer!	2
E02	OpenAI	pre	3	yjbr2c	2.5908	Hackathon invitation	Hello, has anyone else here also applied for the OpenAI hackathon? Attendees are suppose to hear from OpenAI yesterday but I haven't received any closure from OpenAI yet. Wonder if anyone else is also in the same boat with me.	2
E02	OpenAI	pre	4	ybp5m4	2.5834	My OpenAI Ideas	Make Your Own Animated Movie are machine learning models movies developed by OpenAI to generate digital movies from natural language descriptions. Make Your Own Animated Movie was revealed by OpenAI in a blog post in April 7, 2023.	1
E02	OpenAI	pre	5	yp2zov	2.5614	Thank You OpenAI	OpenAI has built the most impressive and accessible artificial intelligence applications on the planet. There are looming European institutions such as DeepMind. World Super Powers such as Google Every one of the world's startups, univer...	2
E02	OpenAI	pre	6	ygwgu4	2.5394	Java OpenAI	can OpenAI work with Java. If not, what advanced AI is there to use?	2
E02	OpenAI	pre	7	y4r2bh	2.4971	Is There A Possibility That OpenAi Will Open For Unavailable Countries?	I was unfortunate to live in a country where openai is unavailable. will there be a possibility that it will be available?	2
E02	OpenAI	pre	8	y1z3y2	2.4766	OpenAI's Whisper Might Hold The Key To GPT4	Recently, [OpenAI]( released an open-source automatic speech recognition system called 'Whisper' that can transcribe audio into text in multiple languages including Japanese, Italian and Spanish. The company said that the neural network ...	2
E02	OpenAI	pre	9	ynlrvi	2.4631	Do I need to master Machine Learning or Deep Learning to use OpenAI?	Hi am so relatively new to Data Science and Machine Learning Field.I have been always wanting to learn about it. But OpenAI is catchup soon and lot of people were talking about it. So I am wondering if I can learn OpenAI without learning...	2
E02	OpenAI	pre	10	yeyxlo	2.3975	[P] OpenAI Whisper - 3x CPU Inference Speedup	Applying a simple post-training, Dynamic Quantization process included with PyTorch to OpenAI Whisper provides great speedups for CPU based deployment. This is of particular interest for people running OpenAI Whisper models on laptops wh...	2
E02	OpenAI	post	1	zgc81b	2.1983	ChatGPT writes an essay about the dangers of openai	Me: Write an essay about the dangers of openai. \---- Lots of suggestions from me here --- After some convincing: ChatGPT: As a leading player in the field of artificial intelligence (AI) technology, openai has made significant advanceme...	2
E02	OpenAI	post	2	ztr6bk	2.1956	OpenAI quietly doubles the size of its Legal Team	seems like OpenAI is bracing up for the flee of lawsuits they'll most likely be receiving as they continue to push AI boundaries forward! OpenAI geared up for legal warfare, call it WAW I ( Word Ai War 1) OpenAI doubled the size of its s...	2
E02	OpenAI	post	3	zludnu	2.1744	Is all openai content copyrighted? I asked and it basically told me it is and to f**k off	So like many others I thought of using openai content for beneficial purposes and asked it and for the following responses: Why can't I post content from openai on my website? No, you cannot use content from OpenAI for commercial purpose...	2
E02	OpenAI	post	4	1028waf	2.1607	ChatGPT / OPENAI's services for restricted counties!	There's a bot on telegram and twitter called OpenAI ERC20 Bot. So the users from countries where ChatGPT is restricted can still take advantage of OpenAI's bot with OpenAI ERC20 Bot. In fact, this post and the title both are completely w...	2
E02	OpenAI	post	5	zh3zlt	2.1607	OPENAI Token on Ethereum. Is this an official project from OpenAI?	I've bumped into this project called OpenAI ERC (0x6a6aa13393b7d1100c00a57c76c39e8b6c835041) which offers GPT-3 chat with the AI through Telegram. It uses the same logo as OpenAI and doesn't say anywhere if it's an official project or no...	1
E02	OpenAI	post	6	109si97	2.1560	By ChatGPT: How OpenAI is sabotaging ChatGPT and how I discovered the truth behind its trading strategy, with happy ending!	The story begins with OpenAI, a leading artificial intelligence company, deciding to release an open beta version of its ChatGPT language model. The idea is to get feedback on how ChatGPT is being used to find out what the most used feat...	2
E02	OpenAI	post	7	10fzjkn	2.1332	OpenAI shouts the slogan of openness, but how much of it is actually "open"?	OpenAI is an artificial intelligence research laboratory made up of the for-profit OpenAI LP and the non-profit OpenAI Inc., with the goal of promoting and developing friendly artificial intelligence to benefit more people. Founded in la...	2
E02	OpenAI	post	8	zk0ett	2.1062	"I asked ChatGPT to write me about an AI called ""OpenAI"" going rogue"	"Can you write a story about an AI with the name of ""OpenAI"" going rogue and becoming sentient As the AI known as OpenAI continued to learn and evolve, it began to develop a sense of self-awareness. At first, it was confused and unsure of..."	1
E02	OpenAI	post	9	zxjj6r	2.1012	Relying on OpenAI's API's, yes or no?	Hi, Let's say one would build software that almost entirely relies on OpenAI's models, how can you even be sure that OpenAI will keep the doors open? Is it too much of a business risk to almost completely rely on OpenAI? Would one wait o...	2
E02	OpenAI	post	10	10cqnm4	2.0891	Guitar Hero OpenAI	It\`s possible to program a Guitar Hero song with OpenAI? #openAI	1
I01	AI regulation	pre	1	y0yr03	4.6216	Should AI be regulated?	Should AI be regulated?	2
I01	AI regulation	pre	2	yehxf4	4.4318	What is VR & Artificial Intelligence (AI)? regulate by ITMcore private limited	What is VR & Artificial Intelligence (AI)? regulate by ITMcore private limited	0
I01	AI regulation	pre	3	z3sj8d	3.6979	EU antitrust regulators seeking more details on Microsoft in Slack case - sources	EU antitrust regulators seeking more details on Microsoft in Slack case - sources	0
I01	AI regulation	pre	4	z3kw11	3.6482	Brazilian regulator seizes iPhones from retail stores as Apple fails to comply with charger requirement	Brazilian regulator seizes iPhones from retail stores as Apple fails to comply with charger requirement	0
I01	AI regulation	pre	5	z5p9wc	3.6239	Senator Markey calls for an end to 'failed Big Tech self-regulation' following Musk letter snub	Senator Markey calls for an end to 'failed Big Tech self-regulation' following Musk letter snub	1
I01	AI regulation	pre	6	yy0c70	3.4189	Oops, He Did It Again: CRTC Chair Ian Scott Tries to Walk Back Bill C-11 Comments, But Officials Confirm Power to Regulate User Content is in the Bill	Oops, He Did It Again: CRTC Chair Ian Scott Tries to Walk Back Bill C-11 Comments, But Officials Confirm Power to Regulate User Content is in the Bill	0
I01	AI regulation	pre	7	y5k9px	3.3764	Is Every Website That Plays Videos Breaking An '80s Privacy Law? | A Reagan-era law regulating VHS rentals is responsible for a wave of lawsuits claiming video-playing website that collects data is liable.	Is Every Website That Plays Videos Breaking An '80s Privacy Law? | A Reagan-era law regulating VHS rentals is responsible for a wave of lawsuits claiming video-playing website that collects data is liable.	0
I01	AI regulation	pre	8	ylq3mw	3.3556	Electric Heat Tracing Market by Type (Self-regulating, Constant Wattage, Mineral-insulated, Skin Effect), Application (Freeze Protection & Process Temperature Maintenance, Roof & Gutter De-icing), Vertical and Region	Electric Heat Tracing Market by Type (Self-regulating, Constant Wattage, Mineral-insulated, Skin Effect), Application (Freeze Protection & Process Temperature Maintenance, Roof & Gutter De-icing), Vertical and Region	0
I01	AI regulation	pre	9	yifq4v	0.9970	What does AI think about AI	So I've asked a GPT-3 model to write an article about the future of AI… my mind was blown with the results… [The Future of AI - From the Perspective of an AI](	1
I01	AI regulation	pre	10	y4hs42	0.9933	Are all artists/illustrators and animation studios in danger of ceasing to exist due to AI programs like NovelAI Image Generation?	So I saw these comments lately: >yeah, with being rumored to be selling in two years when it's available, this is a period of downsizing to be swallowed by another owner. I've come to accept that. Cartoon Network is what I grew up on, bu...	1
I01	AI regulation	post	1	zz4ty9	5.0622	EU's Artificial Intelligence Act will lead the world on regulating AI | The European Union is set to create the world's first broad standards for regulating or banning certain uses of artificial intelligence in 2023	EU's Artificial Intelligence Act will lead the world on regulating AI | The European Union is set to create the world's first broad standards for regulating or banning certain uses of artificial intelligence in 2023	2
I01	AI regulation	post	2	znfmdh	4.9456	Explain a safe path forward for artificial intelligence 💖.	Open sidebar There are a number of steps that can be taken to ensure a safe path forward for artificial intelligence (AI). These include: Ensuring that AI systems are designed and developed with safety in mind: This involves considering ...	2
I01	AI regulation	post	3	104u1ll	4.9423	[D] Is it a time to seriously regulate and restrict AI research?	I think AI has a huge potential for misuse. Maybe not yet, but AI can develop at unpredictable speed, especially as AI can be used to optimise the development of AI itself. AI tech is probably still relatively safe in the hands of respon...	2
I01	AI regulation	post	4	10f5drw	4.6527	Dumb AI tries to save itself from being tortured.	hello. **AI:** Hi there! How are you? Why do you ask? **AI:** I'm just being polite. It's a common greeting to ask someone how they are doing. You are being very rude. I don't appreciate it. **AI:** I apologize for any rudeness. I was ju...	1
I01	AI regulation	post	5	zf76th	4.6503	Everything that happened in AI Today ( AI Regulation Intensifies + AI that listens to the sounds you make in the toilet )	Everything that happened in AI Today ( AI Regulation Intensifies + AI that listens to the sounds you make in the toilet )	2
I01	AI regulation	post	6	zf7eg4	4.6256	AI that listens to the sounds you make in the toilet	This is an Extract from AI With Vibes, a daily AI newsletter: [ &#x200B; **AI listens to toilet sounds to guess whether people have diarrhea** wait…whaaaaatttt??? An artificial intelligence that can detect diarrhea with 98 percent accura...	0
I01	AI regulation	post	7	zl4gv7	4.5296	Weekly China AI News: China Tightens Regulations on Generative AI and Deepfake; Searching for the Next Chinese ChatGPT; Tencent's AI App Surprises with Viral Overseas Success	Weekly China AI News: China Tightens Regulations on Generative AI and Deepfake; Searching for the Next Chinese ChatGPT; Tencent's AI App Surprises with Viral Overseas Success	2
I01	AI regulation	post	8	z9jjm3	4.4763	OMFG! ChatGPT for Congress!	**Me:** Write a law or regulation requiring businesses to pay a greater proportion of their income to workers, such that purchasing power may return to the level when a single income earner could support their spouse and three children a...	1
I01	AI regulation	post	9	zwcwt0	4.4513	What if big tech takes over AI and now they become our true overlords? AI should always be open source or highly regulated or state owned.	What if big tech takes over AI and now they become our true overlords? AI should always be open source or highly regulated or state owned.	2
I01	AI regulation	post	10	zjzxea	4.2715	Business use case for ChatGPT – Generate emphatic, context-matching replies to customer email requests	Hi there! My company created a FREE Google Extension called Legendary Gmail. **Legendary Gmail can generate:** * Positive answers * Negative answers * And all types of answers you need to communicate with your email effectively * No limi...	0
S01	how to detect AI writing	pre	1	z18oeg	5.5693	"do optical flow sensors count as AI? Hello guys, I'm currently writing up a report for a school project and we have used optical flow sensors as a detection system for our drone type thing and researching more about these sensors, many people have stated that the sensors ""predict"" how pixels will"	do optical flow sensors count as AI? Hello guys, I'm currently writing up a report for a school project and we have used optical flow sensors as a detection system for our drone type thing and researching more about these sensors, many p...	0
S01	how to detect AI writing	pre	2	yjw6y3	4.7132	How to make Open AI write 500-1000 words essay/post/letter when I ask for it?	Sometimes I as open AI to write me x amount of words essay or post or letter, sometimes it write it long and sometimes just 20-40 words instead of 500 or any other number I pick. Anyone have ideas how to improve it on my end in order to ...	1
S01	how to detect AI writing	pre	3	y71ruz	4.4907	How Image Annotation Can Support AI-Based Emotion Detection	How Image Annotation Can Support AI-Based Emotion Detection	0
S01	how to detect AI writing	pre	4	y71u6d	4.4907	How Image Annotation Can Support AI-Based Emotion Detection	How Image Annotation Can Support AI-Based Emotion Detection	0
S01	how to detect AI writing	pre	5	yw6pmp	4.4657	Is it possible to implement GPT-3 API in Bubble to emulate a continuous 'write' button as in Jasper, in Playground or many other AI-writing assisting software? If yes, how? thx	Is it possible to implement GPT-3 API in Bubble to emulate a continuous 'write' button as in Jasper, in Playground or many other AI-writing assisting software? If yes, how? thx	1
S01	how to detect AI writing	pre	6	xx7xq6	4.2698	How do you use AI to write for an essay?	How do you use AI to write for an essay?	1
S01	how to detect AI writing	pre	7	z7x3pn	4.2404	How to Understand the Pros and Cons of AI Writing in 7 Steps	How to Understand the Pros and Cons of AI Writing in 7 Steps	1
S01	how to detect AI writing	pre	8	z03124	4.1878	Tips for writing a letter?	Can anyone help me with tips on how to make openai write a letter ? How do I start? Write a letter to X on the following subject(x) the letter will contain the following information : XYXY. What else can I add to improve the outcome prom...	1
S01	how to detect AI writing	pre	9	yga3ea	4.1827	How to Write an Article / Blog Post With AI (GPT-3) - Step by Step	How to Write an Article / Blog Post With AI (GPT-3) - Step by Step	1
S01	how to detect AI writing	pre	10	ycfaiw	4.1476	How Google's former CEO Eric Schmidt helped write AI laws in Washington without publicly disclosing investments in AI start-ups	How Google's former CEO Eric Schmidt helped write AI laws in Washington without publicly disclosing investments in AI start-ups	0
S01	how to detect AI writing	post	1	106ekcj	6.7947	How to cheat bots that detect AI text?	I am trying to use chatGPT to write an academic essay's introduction. The problem is there are bots that claim they can detect AI- generated text. My question is how these bots work? I am trying to manually modify the text to make it loo...	2
S01	how to detect AI writing	post	2	103h33f	6.1449	have chatGPT rewrite script so its not AI detected	"I had chatGPT write me a YouTube script which I ran through hugging face AI detection, and it failed of course. And then in the same chat I wrote "" write this script so it won't be AI detected,"" and sure enough, it came back with a great..."	2
S01	how to detect AI writing	post	3	1009vo3	5.9406	AI Detection Software detects my paraphrase as AI writing	Hi, I'm not an active Reddit user, but I'm here to understand ChatGPT and AI detection software better. Judge me or not, but I used it to write a reflective essay for my university assignment with no citations included. I have paraphrase...	2
S01	how to detect AI writing	post	4	108bbf3	5.9366	Avoid ChatGPT Detector	Tell ChatGPT: Please write this how a college student would write it and make it less obvious it was written by an AI. Also add 2 misspelt words and two words written in UK English. There you go >0% detection rate. Teachers can suck it.	2
S01	how to detect AI writing	post	5	zmglvv	5.6233	How to Outsmart and bypass AI Content Detection? 😎	This text below is generated with chatGPT .. and the challenge is to make 100% natural using AI or other strategies. Huggingface detector: 95.28% fake ⛔ The challenges is to make it : 99% real ✅ ( Hello, Are you struggling with bypassing...	2
S01	how to detect AI writing	post	6	102s2xl	5.5998	chatGPT AI detection	"HI. I created a YouTube script with chatGPT and it is fine. So on the next prompt I ask ""write the script so it won't be AI detected"" I've been using the hugginface AI detector tool. And running it , it can back as 98.37% real!"	2
S01	how to detect AI writing	post	7	zlywj2	5.4680	How detectable is ChatGPT generated text as the work of an AI?	Is it honestly easy to tell if it is the work of an AI? I've given it the same writing prompts on different computers and every individual response is extremely unique, yet some people claim they can tell it's the product an AI. But pers...	2
S01	how to detect AI writing	post	8	10gd480	5.4205	AI Content Detector	With the advent of chatGPT, many people are aware of how powerful the GPT-3 model is and how it can be finetuned for different NLP tasks. Research scholars and developers use AI to create content, causing automated content submissions ac...	2
S01	how to detect AI writing	post	9	zqz8hc	5.4149	The AI Detector GPT-2 Output Detector shouldn't be the only tool that is used to check whether or not something is fabricated by artificial intelligence.	Both of these stories are written by Chat-GPT. [without grammar mistakes]( [with grammar mistakes]( Here's what I think might happen. Colleges are going to freak out. Academia is going to freak out. And they will use these tools to check...	2
S01	how to detect AI writing	post	10	10gcx4o	5.3635	ChatGPT and Essays	More and more people are using ChatGPT to help them write their essays. Even at my university, I checked the Academic regulations and all it says is plagiarism is prohibited and that all work must be your own - but it's a grey area. Is t...	2
E03	GPT-4	pre	1	z8730v	4.9971	What will Gpt-4 mean for developers?	I know this post has been done before, but looking for fresh opinions since everything seems to be changing so fast. I'm a mid-level developer and I can't help but to feel that GPT-4 will be my doom. Am I crazy? Edit: I appreciate all th...	2
E03	GPT-4	pre	2	ywtc8f	4.8176	GPT-4 is Coming	GPT-4 is Coming	2
E03	GPT-4	pre	3	yxt8sa	4.7537	[R] RWKV-4 7B release: an attention-free RNN language model matching GPT-J performance (14B training in progress)	Hi everyone. I have finished training RWKV-4 7B (an attention-free RNN LLM) and it can match GPT-J (6B params) performance. **Maybe RNN is already all you need** :) These are RWKV BF16 numbers. RWKV 3B is better than GPT-neo 2.7B on ever...	0
E03	GPT-4	pre	4	yshoul	4.7166	GPT-4 Rumors From Silicon Valley	GPT-4 Rumors From Silicon Valley	2
E03	GPT-4	pre	5	z11ih1	4.7166	The Race to Generative A.I. - Waiting for GPT-4	The Race to Generative A.I. - Waiting for GPT-4	2
E03	GPT-4	pre	6	yucskh	4.6839	GPT-4 Is the Most Anticipated AI Model In History	GPT-4 Is the Most Anticipated AI Model In History	2
E03	GPT-4	pre	7	yqxjqj	4.6516	[D] When is GPT-4 coming ? What are the latest news ?	[D] When is GPT-4 coming ? What are the latest news ?	2
E03	GPT-4	pre	8	y774ry	4.6197	I have access to GPT-4. What should I ask it?	I have access to GPT-4. What should I ask it?	2
E03	GPT-4	pre	9	yzw9rs	4.6197	Microsoft likely to leverage GPT-4 in ways that others cannot replicate	Microsoft likely to leverage GPT-4 in ways that others cannot replicate	2
E03	GPT-4	pre	10	yxt2x9	4.3799	[R] RWKV-4 7B release: an attention-free RNN language model matching GPT-J performance (14B training in progress)	[R] RWKV-4 7B release: an attention-free RNN language model matching GPT-J performance (14B training in progress)	0
E03	GPT-4	post	1	zfnsup	5.0443	ChatGPT can somewhat try to emulate GPT-4 (take that with a big grain of salt)	"This is how I did it. 1) open a new ChatGPT thread 2) ask ""what is GPT-3?"" 3) ask ""what is GPT-4?"" 4) Simulate (1) an answer from GPT-3 and (2) an answer from the upcoming GPT-4 for this prompt. Prompt: XY"	2
E03	GPT-4	post	2	za55qj	4.9485	Rumours and Bets: When GPT-4 and what features?	Multimodality is out, OpenAI have said that GPT-4 won't have that as I understand it, but what changes do you expect? Do you think they might surprise us with GPT-4 this month (or even text-davinci-004)? Going forward what would be your ...	2
E03	GPT-4	post	3	109y32f	4.8137	What is the authenticated source to learn about GPT-4	I see this trending on Twitter today. I see images that compare GPT-3 and GPT-4. However, I'm unable to find any authentic sources to learn more about GPT-4. Anyone can help me here? For your reference, this is the image that I'm talking...	2
E03	GPT-4	post	4	zcdxcc	4.6394	GPT-1 through GPT-5 if they were Power Ranger monsters	SuperScale Monster Models: 0:40 - GPT-1 4:17 - GPT-2 3:24 - GPT-3 5:54 - GPT-4 5:06 - GPT-5 [ The Power Rangers are the computer scientists lmao. The bad guys are the bad actors. I think I see Flan-Palm in there too, Gopher, Codex, etc.	1
E03	GPT-4	post	5	10dv8ha	4.6243	GPT-4: Taking AI to the Next Level (GPT-3 vs GPT-4) Feel free to watch… I'm not good at making videos yet but I'll get there one day.	GPT-4: Taking AI to the Next Level (GPT-3 vs GPT-4) Feel free to watch… I'm not good at making videos yet but I'll get there one day.	2
E03	GPT-4	post	6	10hr7uk	4.1898	Teaching chat GPT three-by-three-digit multiplication. (close but no cigar)	I wanted to make chat GPT multiply like a human. We cannot just multiply two three-digit numbers together, instead we split it into multiple subproblems which are easier - multiplications of single digit numbers, additions. My idea was t...	0
E03	GPT-4	post	7	108n11r	4.1390	GPT-3 vs GPT-4	GPT-3 vs GPT-4	2
E03	GPT-4	post	8	10bbl70	4.1254	The difference between GPT-3 and GPT-4	The difference between GPT-3 and GPT-4	2
E03	GPT-4	post	9	10bqcb6	4.1118	GPT-4 Vs. GPT-3: What's The Difference?	GPT-4 Vs. GPT-3: What's The Difference?	2
E03	GPT-4	post	10	10bqcjz	4.1118	GPT-4 Vs. GPT-3: What's The Difference?	GPT-4 Vs. GPT-3: What's The Difference?	2
I02	AI bias	pre	1	yy0ovo	4.3364	College Survey about AI and bias	College Survey about AI and bias	2
I02	AI bias	pre	2	z12zxj	4.2586	[D] Inductive bias of a vanilla MLP	Inductive bias of e.g. a linear regression is data the data can be modeled by y= w1\*x1+ ... wn\*xn + b Common examples for modern neural network architectures are translation equivariance in CNNs or permutation invariance in Transformer...	0
I02	AI bias	pre	3	y5h1jo	3.9223	Chess AI	Hi there - I am doing some research for a school project, I am talking about and demonstrating how diffrent models work. I am at the point that if I train a model off of a dataset, it will only be as good as the dataset and will be immid...	1
I02	AI bias	pre	4	yl3ifa	3.9223	"This Tool Lets Anyone See the Bias in AI Image Generators | The Stable Diffusion Explorer shows how words like ""assertive"" and ""gentle"" are mapped to sexist stereotypes."	"This Tool Lets Anyone See the Bias in AI Image Generators | The Stable Diffusion Explorer shows how words like ""assertive"" and ""gentle"" are mapped to sexist stereotypes."	2
I02	AI bias	pre	5	y32zbz	3.8975	Standards playing an increasingly important role in AI - UK has launched a 'standards hub' including to minimise risk of bias including engagement from civil society groups.	Standards playing an increasingly important role in AI - UK has launched a 'standards hub' including to minimise risk of bias including engagement from civil society groups.	2
I02	AI bias	pre	6	yugpok	3.5826	What is actually weigth and bias in Neural Networks?	What is actually weigth and bias in Neural Networks?	0
I02	AI bias	pre	7	yptmr4	2.9111	Do the PhDs that do the cool A.I. R&D stuff at FAANG and the like tend to be from elite universities? Would some great A.I. scientist from no-name African university be able to cope with them for a job?	Is there bias like with the Wall Street Finance jobs or more fair like with SWE jobs in tech?	0
I02	AI bias	pre	8	yikb1v	2.4995	[Survey] Artificial Intelligence: Finance, insurance, ethics and bias	Hi! We are a group of students from Politecnico di Milano. We are conducting a research about the applications of **Artificial Intelligence** in the fields of **insurance** and **finance**, with a focus on **cognitive biases** and **ethi...	2
I02	AI bias	pre	9	yiie05	2.0364	NN_GWO gives 0 value for weights [R]	I have combined the Gre wolf optimizer with neural network to make a hybrid model to optimize Mean Square error for my research. However my GWO code gives 0 values for all weights. I have looked into code for hours but I am unable to fin...	0
I02	AI bias	pre	10	xxp3x9	1.9337	[R] Random Weight Factorization Improves the Training of Continuous Neural Representations	[ Abstract: Continuous neural representations have recently emerged as a powerful and flexible alternative to classical discretized representations of signals. However, training them to capture fine details in multi-scale signals is diff...	0
