qid	query	period	rank	docid	score	title	snippet	relevance
E05	Stable Diffusion	pre	2	yst2wj	5.5544	We just release a complete open-source solution for accelerating Stable Diffusion pretraining and fine-tuning!	Hey folks. We just release a **complete open-source solution** for accelerating Stable Diffusion pretraining and fine-tuning. It help **reduce the pretraining cost by 6.5 times, and the hardware cost of fine-tuning by 7 times, while simu...	2
E05	Stable Diffusion	pre	3	ysfimk	5.2776	[D]We just release a complete open-source solution for accelerating Stable Diffusion pretraining and fine-tuning!	Hey folks. We just release a **complete open-source solution** for accelerating Stable Diffusion pretraining and fine-tuning. It help **reduce the pretraining cost by 6.5 times, and the hardware cost of fine-tuning by 7 times, while simu...	2
E05	Stable Diffusion	pre	4	z6tfna	5.1412	[N] Use Stable Diffusion 2 with the diffusers library	You can run Stable diffusion 1.4, 1.5 or 2 with zero changes to your code using the diffusers library. Check out the release notes Everything is supported: attention optimizations, fp16, img2image, swappable schedulers,... As for SD 2, t...	2
E05	Stable Diffusion	pre	5	y857n7	4.9730	[P] Training anime diffusion model from scratch with limited compute	[Blog post]( This uses a [nice dataset]( by /u/gwern, and trains a decent latent-diffusion-based model from scratch, with several orders of magnitude less compute than Stable Diffusion (although anime-only, but it is better than Stable D...	1
E05	Stable Diffusion	pre	6	y9yq3o	4.9721	Julian Lennon Release MV Using AI with Stable Diffusion & Disco Diffusion	Julian Lennon Release MV Using AI with Stable Diffusion & Disco Diffusion	2
E05	Stable Diffusion	pre	7	y7x2fg	4.9186	Stability AI uses latent diffusion models to allow users to create art in Stable Diffusion	Stability AI uses latent diffusion models to allow users to create art in Stable Diffusion	2
E05	Stable Diffusion	pre	8	y9z2mj	4.9186	Julian Lennon releases music video using AI through Stable Diffusion. & Disco Diffusion	Julian Lennon releases music video using AI through Stable Diffusion. & Disco Diffusion	2
E05	Stable Diffusion	pre	9	ymo07f	4.9186	[P] Finetuned Diffusion: multiple fine-tuned Stable Diffusion models, trained on different styles	[P] Finetuned Diffusion: multiple fine-tuned Stable Diffusion models, trained on different styles	2
E05	Stable Diffusion	pre	10	yo23b9	4.8836	[P] Stable-diffusion's implementation of Paint-with-words : method from NVIDIA that generates images from text-labeled segmentation map.	Hi. Very recently researchers from NVIDIA released their recent work on text-to-image diffusion models, eDiffi ([ . In their paper they proposed various methods, including paint-with-words. Paint-with-words let you generate image from ar...	2
E05	Stable Diffusion	post	1	ztkmv7	7.9796	[P] Combining Kakaobrain's Karlo text-conditional diffusion model with Stable-Diffusion 2.1 (WebUI)	Github Link: [ I made **stable-karlo**, an app that combines Kakaobrain's Karlo image generation model with Stable-Diffusion 2.1 in a nice webUI. Recently, Kakaobrain released Karlo, their own image generating diffusion model which uses ...	2
E05	Stable Diffusion	post	2	z9q0pq	7.8918	[P] Probably the Fastest Open Source Stable Diffusion is released	Hi everyone, we just release probably the fastest Stable Diffusion. The following two pictures show that **on A100 GPU, whether it is PCIe 40GB or SXM 80GB, OneFlow Stable Diffusion leads the performance results** compared to other deep ...	2
E05	Stable Diffusion	post	3	102pl9a	7.8850	Maria the Brazilian Love Paris but Hate Stable Diffusion 2.0	Meet Maria GPT from Rio de Janeiro, she loves Paris but hate Stable Diffusion 2.0 [Maria Love Paris]( &#x200B; [But not so much Stable Diffusion](	1
E05	Stable Diffusion	post	4	10ipib4	7.3871	[P] stable-karlo - Combining the Karlo diffusion model (based on OpenAI's unCLIP) with Stable-Diffusion v2 upscaling (Local UI + Colab notebook)	[P] stable-karlo - Combining the Karlo diffusion model (based on OpenAI's unCLIP) with Stable-Diffusion v2 upscaling (Local UI + Colab notebook)	2
E05	Stable Diffusion	post	5	10itcjt	7.3871	[P] stable-karlo - Combining the Karlo diffusion model (based on OpenAI's unCLIP) with Stable-Diffusion v2 upscaling (Local UI + Colab notebook)	[P] stable-karlo - Combining the Karlo diffusion model (based on OpenAI's unCLIP) with Stable-Diffusion v2 upscaling (Local UI + Colab notebook)	2
E05	Stable Diffusion	post	6	zdfrnw	7.3627	"[D] Is there an affordable way to host a diffusers Stable Diffusion model publicly on the Internet for ""real-time""-inference? (CPU or Serverless GPU?)"	"I have a fine-tuned Stable Diffusion Model and would like to host it to make it publicly available. Both options (GPU, CPU) seem to be problematic. 1. I can't find a ""cheap"" GPU hosting platform. AWS etc. are all > 200$ per month and the..."	2
E05	Stable Diffusion	post	7	zvzix2	7.3386	[P] I built an API that makes it easy and cheap for developers to build ML-powered apps using Stable Diffusion	Hey folks, I built [TuneMyAI]( to make it incredibly simple for developers to finetune and deploy Stable Diffusion models to production so they can focus on building great products. As an app developer myself, I spent a while trying to f...	2
E05	Stable Diffusion	post	8	zu17p5	7.3011	Song Lyrics by ChatGPT & Artwork by Stable Diffusion	Experiment to have ChatGPT write me lyrics for a song about a boy that turns to dust and it travels the world. Album artwork by Stable Diffusion.	2
E05	Stable Diffusion	post	9	10dfex7	7.3009	[D] The Illustrated Stable Diffusion (Video)	I'll be honest with you, it took me months to wrap my head around diffusion models. A couple of iterations of a [blog post]( later and this is my best shot at a gentle intro to Stable Diffusion and how it works. [ The part that took the ...	2
E05	Stable Diffusion	post	10	100h2dd	7.2170	Anyone tried generating prompt ideas for Stable Diffusion via chatGPT?	I remember trying to type SD some time ago but it won't recognize what stable diffusion is. Is there any other way to let it make one?	2
